Album,Song,Lyrics
have one on me,2010,does not suffice,i will pack up my pretty dresses i will box up my highheeled shoes a sparkling ring for every finger ill put away and hide from view coats of bouclé jacquard and cashmere cartouche and tweed all silver shot and everything that could remind you of how easy i was not ill tuck away my gilded buttons ill bind my silks in shapeless bales wrap it all on up in reams of tissue and then ill kiss you sweet farewell you saw me rise to our occasion and so deny the evidence caused me to burn and twist and grimace against you like something caught on a barbedwire fence now you can see me fall back here redoubled full bewildered and amazed i have gotten into some terrible trouble beneath your blank and rinsing gaze it does not suffice for you to say i am a sweet girl or to say you hate to see me sad because of you it does not suffice to merely lie beside each other as those who love each other do i picture you rising up in the morning stretching out on your boundless bed beating a clear path to the shower scouring yourself red the tap of hangers swaying in the closet unburdened hooks and empty drawers and everywhere i tried to love you is yours again and only yours 
divers,2015,anecdotes,sending the first scouts over back from the place beyond the dawnhorse bear your broken soldier eyes frozen wide at what went on and time in our camp is moving as youd anticipate it to but what is this sample proving anecdotes cannot say what time may do i kid with rufous nightjar when our men are all asleep it aint about how rare you are but how hard you are to see take you and me “when are you from” said he in our blind of winter leaves as we sighted out their fliers in the grayscale of the night fumbled on the bare ground to bury round landmines while the dew lay down and dried we signal private poor will when morning starts to loom pull up from your dive till we hear the telltale boom too soon hotdogging loon caught there like a shard of mirror in the moon now theyve stopped giving orders but i follow anyway laying in our state of torpor waiting out the day while the dew burns away rushing tearing speeding homebound to a wheel that is not my own where round every bend i long to see temporal infidelity and all along the road the lights stream by i want to go where the dew wont dry i want to go where the light wont bend far as the eye may reach nor end but inasmuch as that light is loaned insofar as weve borrowed bones must every debt now be repaid in star spotted sickle winged night raids while we sing to the garden and we sing to the stars and we sing in the meantime wherever you arein the folds and the branches somewhere out there i was only just born into open air now hush little babe you dont want to be down in the trenches remembering with me where you will not mark my leaving and you will not hear my parting song nor is there cause for grieving nor is there cause for carrying on and daughter when you are able come down and join the kettles on and your familys round the table will you come down before the sun is gone
divers,2015,sapokanikan,the cause is ozymandian the map of sapokanikanis sanded and beveled the land lone and leveled by some unrecorded and powerful hand which plays along the monument and drums upon a plastic bag the brave men and women so dear to god and famous to all of the ages rag sing do you love me will you remember the snow falls above me the renderer renders the event is in the hand of god beneath a patch of grass her bones the old dutch master hid while elsewhere tobias and the angel disguised what the scholars surmised was a mother and kid interred with other daughters in dirt in other potters fields above them parades mark the passing of days through parks where pale colonnades archin marble and steel where all of the twenty thousand attending your foot fall and the cause that they died for are lost in the idling bird calls and the records they left are cryptic at best lost in obsolescence the text will not yield nor xray reveal with any fluorescence where the hand of the master begins and ends i fell i tried to do well but i wont be will you tell the one that i loved to remember and hold me i call and call for the doctor but the snow swallows me whole with old florry walker the event lives only in print he said its alright and its all over now  and boarded the plane his belt unfastened the boy was known to show unusual daring and called a boy this alderman confounding tammany hall in whose employ king taman end himself preceded johns fall so we all raise a standard to which the wise and honest soul may repair to which a hunter a hundred years from now may look and despair and see with wonder the tributes we have left to rust in the parks wearing that our hair stood on end to see john purroy mitchel depart for the western front where work might count all exeunt all go out await the hunter to decipher the stone and what lies under now the city is gone look and despair look and despair 
divers,2015,leaving the city,hay and a clean stall and ivy on a garden wall and a sign saying sold and an old coat for the bad cold i believe in you do you believe in me what do you want to do are we leaving the city on the black road through the gold fields while the fields are plowed towards what we are allowed the bridle bends in idle hands and slows our canter to a trot we mean to stop in increments but cant commit we post and sit in impotence the harder you hit the deeper the dent we seek our name we seek our fame and our credentials paned in glass trained to master incidentals bleach our collar leech our dollar from our cents the longer you live the higher the rent beneath the pale sky beside the red barn below the white clouds is all we are allowed here the light will seep and the scythe will reap and spirit will rend in counting toward the end in december of that year the word came down that she was here the days grew shorter i was sure if she came round id hold my ground id endure but theyd alluded to a change that came to pass and spring deranged weeping grass and sleepless broke herself upon my window glass and i could barely breathe for seeing all the splintered light that leaked her fissures fleeing launched in flight unstaunched daylight brightly bleeding bleached the night with dawn deleting in that high sun after our good run when the spirit bends beneath knowing it must end and that is all i want hereto draw my gaunt spirit to bow beneath what i am allowed beneath what i am allowed 
divers,2015,goose eggs,what we built at the kiln that wont be stilled did not set well the old veil of desire like the vessels that we fired fell thin as eggshells and every season somebody burns downtown taking turns—taking a bus to take a train and just plain vamoose now the wind blows coals over the hills honey ive been paying my bills but honey its been a long time since ive come to any use and it hurt me bad when i heard the news that youd got that call and could not refuse a goose alone i suppose can know the loneliness of geese who never find their peace whether north or south or west or east west or east and i could never find my way to being the kind of friend you seemed to need in me till the needing had ceased recently a bottle of rye and a friend and me on our five loose legs had a ramble and spoke of the scrambling of broken hopes and goose eggs and a stranger long ago not you honey you i know we just spoke of broken hopes and old strangers now the wind blows coals over the sea tell you what honey you and me better run and see if we cant contain them first but you had somewhere that you had to go and you caught that flight out of covalo now overhead youre gunning in those vs where you had better find your peace whether north or south or west or east west or east and i had better find my way to being the kind of friend you seemed to need in me at last at least whats redacted will repeat and you cannot learn that you burn when you touch the heat so we touch the heat and we cut facsimiles of love and death just separate holes in sheets where you cannot breathe and you cannot see and i cannot now for the life of me believe our talk our flock had cause to leave but do we do we
divers,2015,waltz of the 101st lightborne,i believed they had got what they came for i believed our peril was done on the eve of the last of the great wars after three we had narrowly won but the fourth it was carelessly done saw his ship in its whistling ascension as they launched from the capitol seat swear i saw our mistake when the clouds draped like a flag across the backs of the fleet of the hundred first lightborne elite as the day is long so the well runs dry and we came to see time is taller than space is wide and we bade goodbye to the great divide found unlimited simulacreage to colonize but there was a time we were lashed to the prow of a ship you may board but not steer before you and i ceased to mean now and began to mean only right here to mean inches and miles but not years before space had a taste of its limits and a new sort of coordinate awoke making time just another poor tenant bearing weight taking fire trading smokes in the war between us and our ghosts but i saw the bering strait and the golden gate in silent suspension of their golden age and you can barely tell if i guard it well where i have been and seen pristine unfelled and i had a dream that i walked in the garden of chabot and those telescope ruins it was there that i called to my true love who was pale as millennial moons honey where did you come by that wound when i woke he was gone and the war had begun in eternal return and repeat calling where in the hell are the rest of your fellow one hundred one lightborne elite stormed in the new highland light infantry make it stop my love we were wrong to try never saw what we could unravel in traveling light or how the trip debrides like a stack of slides all we saw was that time is taller than space is wide thats why we got bound to a round desert island neath the sky where our sailors have gone have they drowned in those windy highlandshighlands away my john 
divers,2015,the things i say,if i have the space of half a day im ashamed of half the things i say im ashamed to have turned out this way and i desire to make amends but it dont make no difference now and noones listening anyhow and lists of sins and solemn vows dont make you any friends theres an old trick played when the light and the wine conspire to make me think im fine im not but i have got half a mind to maybe get there yet when the sky goes pink in paris france do you think of the girl who used to dance when youd frame her moving within your hands saying this i wont forget what happened to the man you were when you loved somebody before her did he die or does that man endure somewhere far away our lives come easy and our lives come hard and we carry them like a pack of cards some we dont use but we dont discard but keep for a rainy day 
divers,2015,divers,the diver is my loveand i am his if i am not deceived who takes one breath above for every hour below the sea who gave to me a jewel worth twice this womans life but would cost her less than laying at low tide to see her true love phosphoresce and in an infinite regress tell me why is the pain of birth lighter borne than the pain of death i aint saying that i loved you first but i loved you best i know we must abide each by the rules that bind us here the divers and the sailors and the women on the pier but how do you choose your form how do you choose your name how do you choose your life how do you choose the time you must exhale and kick and rise and in an infinite capsize like a bull tearing down the coast double hulls bearing double masts—i dont know if you loved me most but you loved me last recall the word you gaveto count your way across the depths of this arid world where you would yoke the waves and lay a bed of shining pearls i dream it every night the ringing of the pail the motes of sand dislodged the shucking quick and bright the twinned and cast off shells reveal a single heart of white and in an infinite backslide ancient border sink past the west like a sword at the bearers fall i cant claim that i knew you best but did you know me at alla woman is alive a woman is alive you do not take her for a sign in nacre on a stone alone unfaceted and fine and never will i wed ill hunt the pearl of death to the bottom of my life and ever hold my breath till i may be the divers wife see how the infinite divides and the divers are not to blame for the rift spanning distant shores you dont know my name but i know yours 
divers,2015,same old man,its the same old lady putting out the wash standing in the rain in her mackintosh same old lady standing in the rain the thought of new york was going insane hey little leaf lying on the ground now youre turning slightly brown why dont you come back on the tree turn the color green the way you ought to bemy mind is failing and my body grows weak and my lips wont form the words i speak and im floating away on a barrel of pain new york city wont see me again its the same old man sitting at the mill mill wheel turning of its own free will im certainly glad to be at home new york city continues on alone im certainly glad to be at home new york city continues on alone new york city continues on alone new york city continues   
divers,2015,you will not take my heart alive,and what do you remember most the line of the sea seceding the coast fine capillaries glowing with cars the comfort you drew from the light of the stars and how long did you climb that night with the ice in your lungs on the rungs of the light beyond recall you severed all strings to everyone and everything oh silent constant driver of mine wordlessly calling from the end of the line where even though each hour i ever loved must queue and dive still you will not take my heart alive you will not take my heart alive you will not take my heart alive you will not take my heart in martial wind and in clarion rain we minced into battle wincing in pain not meant for walking backs bound in twine not angel or devil but level in time and i rose to take my shape at last from the dreams that had dogged me through every past when to my soul the body would say you may do what you like as long as you stay now the towns and forests highways and plains fall back in circles like an emptying drain and i wont come round this way again where the lonely wind abides and you will not take my heart alive you will not take my heart alive you will not take my heart alive you will not take my heart alive you will not take my heart alive you will not take my heart alive you will not take my heart alive you will not take my heart 
divers,2015,a pinlight bent,my life comes and goes my life comes and goes short flight free row i lie down and doze my life came and went my life came and went short flight free descent poor flight attendant but the sky over the ocean and the ocean skirting the city and the city bright as a garden when the garden woke to meet me from that height was a honeycomb made of light from those funny homes intersected each enclosed anelectric and alone in our lives is a common sense that relies on the common fence that divides and attends but provides scant defense from the great light that shines through a pinhole when the pinlight calls itself selfhood and the selfhood inverts on a mirror in an amora obscura but its mine or at least its lent and my life until the time is spent is a pinlight bent its a pinlight bent 
divers,2015,time as a symptom,time passed hard and the task was the hardest thing shed ever do but she forgot the moment she saw you so it would seem to be true when cruel birth debases we forget when cruel death debases we believe it erases all the rest that precedes but stand brave life liver bleeding out your days in the river of time stand bravetime moves both ways in the nullifying defeating negating repeating joy of life the nullifying defeating negating repeating joy of life the moment of your greatest joy sustains not axe nor hammer tumor tremor can take it away and it remains it remains and it pains me to say i was wrong love is not a symptom of time time is just a symptom of love and of the nullifying defeating negating repeating joy of life the nullifying defeating negating repeating joy of life hardly seen hardly felt deep down where your fight is waiting down till the light in your eyes is fading joy of life where i know that you can yield when it comes down to it bow like the field when the wind combs through it joy of life and every little gust that chances through will dance in the dust of me and you with joy of life and in our perfect secret keeping one ear of corn in silent reaping joy of life joy again arounda pause a sounda song a way a lone a last a loved a long a cave a grave a day arise ascend areion rharian go free and graze amen a shore a tide unmoored a sight abroad a dawn unmarked undone undarked a god no time no flock no chime no clock no end white star white ship nightjar transmit transcend white star white ship nightjar transmit transcend white star white ship nightjar transmit transcend white star white ship nightjar transmit trans
unreleased,make hay,so long so long so long so long so long my old friend died that way the accumulation of time and the passing of days though she dug in her heels drug her wheels in the clay she dotted her eyes crossed the teasels in her leaning dray where buzzards make circles and tillers make hay a dozen in kettle committee  wake where wind made the dust and sin made the snake and mama made us but what did i make and how was i to know down in our old goldmine where you were the king of the radio and i was the keeper of hifi and i was the queen of the rodeo and everybodyd know and you were the keeper of the lions and we were gored and abased and adored and erased all before our time it was before our time so how was i to know how was i to know while the tune hums and the hand strikes the gong and all of us plough our row and the notes run out of measure and out of time and landing wrong well the day is long but not so long my old friend died alone save for the friends and family she had known surrounding her bed none of whom in that room could with certainty have said ive dotted my eyes crossed the teasels in my leaning sled where buzzards make circles and tillers make hay in windrow and bale with tedder and rake where adam made ribs and cattle make steak and the rattling nib writes what did i make and how was i to know seeing my seconds pass in a line if there was a way to reckon love except as a symptom of timeand honey it stretched out below us humming every note from the lowest to the highest but even at the highest we were bored and amazed in accord in a daze all before our time it was before our time so how was i to know how was i to know how was i to know how was i to know while the day slows and the sun stares stalling into the dimming barrel of night where the stars are falling ive got no say but still im calling for my old friend we sow and we reap again 
unreleased,bombs are whistling,i face it with my flayed skull in a glacial morning windit burns like salt its not your fault that i aint got no skin crying out into the dawn until my voice is gone i call i love you through it all they said i couldnt hold you when i tried to take your hand alarm bells rang the nurse was saying things i cant understand too warm too warm i drew my arm away against the glass is he okay my flayed skull asked i prayed the fear would pass they say you need me here now and i need that… but im needed my eyes scan every place and i stand guard all night in vigil in war dening and in waste unheeded wilds too cold and blue but look at those curls how do you do though i cannot imagine you recall it or conceived long ago and far away i know what i believe i know i know i know because they tell me that its true the spell will break and wake me anew so i sit and rock and drop through space and kiss your face and singthe smoke is thick my skin is sick the bombs are whistling the death the doom the leaden looming dread is always near but i love you and you are here i feared that it had woni feared that you would never find me my darling suns on but you found me and though it took awhile now i look and find your blinding starlight smile surrounds mewe bleed through clear and true here with you now i wish that i could show you what i know about this pain ill tell ya now i dont know how but ill be back again for bowed within the scouring wind that lays low everything i love you my flayed skull sings
unreleased,marie at the mill,i see you coming down in your cherry wool coatbare to the throat like marie at the mill where might you go from your lowly amour where they hoard you like gold in the hills sink from my side to the cold riverbed mary you go ahead i will follow in timethe work keeps me here with a few pioneers magnetizing a permanent line save for the coat there was nothing to bring it was found you could sing you were sent to the bay at seminary you passed and were buried i rose there the very next day for if you werent born at the right time my dear just keep trying and trying and trying again as for the end it is not what you fearyoure just slippin a glove from your hand like this down down down down your wristdown downthe list of lives husbands and wives dozens of times around again and then out of all of the girls heard my coloratura and called me the heir of melba myth i cross the atlantic from boston to nantes on the hand of my dear mr smith then came his talk of perdition and sin like a cold winter wind come to blow me away i was impatient and sought education on stage and the champs élysées i left on my own with the clothes on my back and my own name intact and my own bills to pay i left him in debt with his feather alouette je te plumerai i had the honor to sing mendels sohnon the ternary lawn for the brave and the fool few but it was my joy to be called to bayreuth for who toiled a slave comes anew a prince for gentler worthiness and merit won who ruled a king may wander in rags for things done and undone and done and undone i wed mr russak a fan and producer of amateur musicall lambent in pearls held court in newport amused myself before i threw off the veil of the world and when in time he sank under the sea what he deeded to me was enough to begin as secretary and past emissary i rose through the ranks from within my carnelian snuff bottle carved as a peachand a small sterling wagonwell that was part of the setconsigned to the waters of elliott beachleft behind with your pall mall gazetteand it was not luckput me there by his sidewhen the old colonel diedand the adepts appearedand oh what they sharedwell you had to be therebut ill tell you if you wanna hear“henry your work here is done annie will carry it on marie write it all down til the keynote is found ”you run it up and downand round and round and round andso i think as i couldall the gaps as a pill were for goodand only goodthrough some lapse in a life long forgot id won the right to clean the room and transcribe the thoughtsof the boy from the beach with his pervious soulpoor little teacher got you doing as youre toldand even sothere is danger here in the sun honey tell me what has sirius donei hear it all but i cannot assumenone may i follow to the octagon roomthe boy from the beach beckoned and called lord hell leave and unhand it alli see the clock on the wall i hear the knock on the door but that is alland when my work here is through henry will you find me anewlittle strangermy old friendwoo me and win meagain and again and againall over againall over againall over againthen she singtalks this last partthis is rough so stay with metheres a lodger in melarger than mesaw the cross in the garden where your process came to be andcut you free though your father tried to reunite with you and nitya was allowed to die despite the lies we are grist in the mill on the list im helios still sun wielder brünnhildes running she is running around and round
